<?xml version="1.0" encoding="UTF-8"?>
<DSSV xmlns:xsi="http://www.w3.org/2001/XMLSchema-instance"
      xsi:noNamespaceSchemaLocation="DSSV.xsd">

  <KHOA>
    <MAKHOA>K01</MAKHOA>
    <TEN>cntt</TEN>
  </KHOA>
  <KHOA>
    <MAKHOA>K02</MAKHOA>
    <TEN>toan</TEN>
  </KHOA>

  <LOP>
    <MALOP>L01</MALOP>
    <TEN>lopcntt1</TEN>
    <MAKHOA>K01</MAKHOA>
  </LOP>
  <LOP>
    <MALOP>L02</MALOP>
    <TEN>loptoan1</TEN>
    <MAKHOA>K02</MAKHOA>
  </LOP>

  <SINHVIEN>
    <MSSV>SV001</MSSV>
    <HOTEN>Nguyen Van A</HOTEN>
    <EMAIL>vana@gmail.com</EMAIL>
    <SDT>0912345678</SDT>
    <MALOP>L01</MALOP>
  </SINHVIEN>

  <SINHVIEN>
    <MSSV>SV002</MSSV>
    <HOTEN>Le Thi B</HOTEN>
    <EMAIL>leb@gmail.com</EMAIL>
    <SDT>0987654321</SDT>
    <MALOP>L02</MALOP>
  </SINHVIEN>

</DSSV>
